movie_id,title,overview,genre_ids,popularity
1075794,Leo,"Jaded 74-year-old lizard Leo has been stuck in the same Florida classroom for decades with his terrarium-mate turtle. When he learns he only has one year left to live, he plans to escape to experience life on the outside but instead gets caught up in the problems of his anxious students — including an impossibly mean substitute teacher.","[16, 35, 10751]",7.3165
270946,Penguins of Madagascar,"Skipper, Kowalski, Rico and Private join forces with undercover organization The North Wind to stop the villainous Dr. Octavius Brine from destroying the world as we know it.","[10751, 16, 12, 35]",11.6682
9886,Johnny Mnemonic,"In a dystopian 2021, Johnny is a data trafficker who has an implant that allows him to securely store data too sensitive for regular computer networks. On one delivery run, he accepts a package that not only exceeds the implant's safety limits—and will kill him if the data is not removed in time—but also contains information far more important and valuable than he had ever imagined. On a race against time, he must avoid the assassins sent to kill him and remove the data before it, too, ends his life.","[878, 28, 12]",9.6102
810,Shrek the Third,"The King of Far Far Away has died and Shrek and Fiona are to become King & Queen. However, Shrek wants to return to his cozy swamp and live in peace and quiet, so when he finds out there is another heir to the throne, they set off to bring him back to rule the kingdom.","[14, 12, 16, 35, 10751]",11.4802
957452,The Crow,"Soulmates Eric and Shelly are brutally murdered when the demons of her dark past catch up with them. Given the chance to save his true love by sacrificing himself, Eric sets out to seek merciless revenge on their killers, traversing the worlds of the living and the dead to put the wrong things right.","[28, 14, 27]",10.4108
549509,The Brutalist,"When an innovative modern architect flees post-war Europe, he is given the opportunity to rebuild his legacy. Set during the dawn of the modern United States (in Pennsylvania), his wife joins him, and their lives are forever changed by a demanding, wealthy patron.","[18, 36]",11.3372
384018,Fast & Furious Presents: Hobbs & Shaw,"Ever since US Diplomatic Security Service Agent Hobbs and lawless outcast Shaw first faced off, they just have traded smack talk and body blows. But when cyber-genetically enhanced anarchist Brixton's ruthless actions threaten the future of humanity, they join forces to defeat him.","[28, 12, 35]",10.7134
1318642,Beauty and the Beat,"Imagine the excitement when four rival divas are brought together to perform on the same stage. But remember, when two ride on a horse, one must sit behind. So, how will these four divas share the spotlight without chaos?","[35, 10402]",10.5194
626332,Flamin' Hot,"The inspiring true story of Richard Montañez, the Frito Lay janitor who channeled his Mexican American heritage and upbringing to turn the iconic Flamin' Hot Cheetos into a snack that disrupted the food industry and became a global pop culture phenomenon.","[18, 36]",7.2929
893364,Belle and Sebastian: Next Generation,"10-year-old Sebastien reluctantly spends his vacation in the mountains with his grandmother and aunt. Helping them with the sheep is hardly an exciting prospect for a city boy like him - but that is without considering his encounter with Belle, a huge dog mistreated by her owner. Ready to do anything to fight injustice and to protect his new-found friend, Sebastien will spend the craziest summer of his life.","[12, 10751, 18]",9.1435
419680,Daddy's Home 2,"Father and stepfather Dusty and Brad join forces to make Christmastime perfect for the children. Their newfound partnership soon gets put to the test when Dusty's old-school, macho dad and Brad's gentle father arrive to turn the holiday upside down. After a sudden change in plans, the four men decide to take the kids to a luxury resort for a fun-filled getaway that turns into a hilarious and chaotic adventure.",[35],9.7944
665,Ben-Hur,"In 26 AD, Judah Ben-Hur, a Jew in ancient Judea, opposes the occupying Roman empire.  Falsely accused by a Roman childhood friend-turned-overlord of trying to kill the Roman governor, he is put into slavery and his mother and sister are taken away as prisoners.","[36, 18, 12]",11.3095
1357886,Django Undisputed,"Determined to exact his justice, Django faces dangerous challenges and bloody clashes to restore order in a territory dominated by lawlessness and injustice.",[37],12.5912
9792,The Hills Have Eyes,"Based on Wes Craven's 1977 suspenseful cult classic, The Hills Have Eyes is the story of a family road trip that goes terrifyingly awry when the travelers become stranded in a government atomic zone. Miles from nowhere, the Carter family soon realizes the seemingly uninhabited wasteland is actually the breeding ground of a blood-thirsty mutant family...and they are the prey.","[27, 53]",9.6948
9078,The Sword in the Stone,"Wart is a young boy who aspires to be a knight's squire. On a hunting trip he falls in on Merlin, a powerful but amnesiac wizard who has plans for him beyond mere squiredom. He starts by trying to give him an education, believing that once one has an education, one can go anywhere. Needless to say, it doesn't quite work out that way.","[16, 10751, 14]",8.1956
744275,After We Fell,"Just as Tessa's life begins to become unglued, nothing is what she thought it would be. Not her friends nor her family. The only person that she should be able to rely on is Hardin, who is furious when he discovers the massive secret that she's been keeping. Before Tessa makes the biggest decision of her life, everything changes because of revelations about her family.","[10749, 18]",9.7351
1051486,Stockholm Bloodbath,"In 1520, the notorious and power-hungry Danish King Christian II is determined to seize the Swedish crown from Sten Sture, no matter what it takes. Meanwhile, sisters Freja and Anne make a solemn promise to seek revenge on the men who brutally murdered their family. Everything comes to a head in the heart of Stockholm, where the sisters are drawn into a ruthless political struggle between Sweden and Denmark that culminates in a mass execution, presided over by the mad King ""Christian the Tyrant,"" known as the Stockholm Bloodbath.","[28, 36, 18, 12, 10752]",10.0286
1417,Pan's Labyrinth,"In post–civil war Spain, 10-year-old Ofelia moves with her pregnant mother to live under the control of her cruel stepfather. Drawn into a mysterious labyrinth, she meets a faun who reveals that she may be a lost princess from an underground kingdom. To return to her true father, she must complete a series of surreal and perilous tasks that blur the line between reality and fantasy.","[14, 18, 10752]",10.2357
648457,DEEMO Memorial Keys,"Deemo is a lonely individual who lives in solitude, playing the piano in a castle. One day, a girl who has lost her memory falls from the sky. Wanting to help her recover her memories and return to her world, Deemo discovers that a tree kept atop the piano will grow whenever the piano is played.","[16, 18, 10749, 9648, 14]",10.7217
1084736,The Count of Monte Cristo,"Edmond Dantès becomes the target of a sinister plot and is arrested on his wedding day for a crime he did not commit. After 14 years in the island prison of Château d’If, he manages a daring escape. Now rich beyond his dreams, he assumes the identity of the Count of Monte-Cristo and exacts his revenge on the three men who betrayed him.","[12, 28, 18]",11.2636
100717,The Swinging Co-eds,Young women come to Munich for fun and work during the '72 Olympics and invariably wind up naked.,[35],11.1597
1267905,The Roses,"Life seems easy for picture-perfect couple Ivy and Theo: successful careers, a loving marriage, great kids. But beneath the façade of their supposed ideal life, a storm is brewing – as Theo's career nosedives while Ivy's own ambitions take off, a tinderbox of fierce competition and hidden resentment ignites.",[35],10.9923
608,Men in Black II,"Kay and Jay reunite to provide our best, last and only line of defense against a sinister seductress who levels the toughest challenge yet to the MIB's untarnished mission statement – protecting Earth from the scum of the universe. It's been four years since the alien-seeking agents averted an intergalactic disaster of epic proportions. Now it's a race against the clock as Jay must convince Kay – who not only has absolutely no memory of his time spent with the MIB, but is also the only living person left with the expertise to save the galaxy – to reunite with the MIB before the earth submits to ultimate destruction.","[28, 35, 878]",15.1664
1437256,죽기 전에 한 번만,,[18],9.3824
1220564,The Secret Agent,"In 1977 Brazil, technology specialist Marcelo, fleeing a mysterious past, returns to Recife in search of peace, but realizes the city is far from the refuge he seeks.","[80, 18, 53, 9648]",11.2127
102651,Maleficent,"A beautiful, pure-hearted young woman, Maleficent has an idyllic life growing up in a peaceable forest kingdom, until one day when an invading army threatens the harmony of the land. She rises to be the land's fiercest protector, but she ultimately suffers a ruthless betrayal – an act that begins to turn her heart into stone. Bent on revenge, Maleficent faces an epic battle with the invading King's successor and, as a result, places a curse upon his newborn infant Aurora. As the child grows, Maleficent realizes that Aurora holds the key to peace in the kingdom – and to Maleficent's true happiness as well.","[14, 12, 28, 10751, 10749]",11.5007
1032823,Trap,"A father and teen daughter attend a pop concert, where they realize they're at the center of a dark and sinister event.","[80, 53]",9.8843
807172,The Exorcist: Believer,"Since his wife's death, Victor has raised his daughter Angela alone. After she and her friend return from a three-day disappearance with missing memories, they begin displaying frightening behavior reminiscent of the MacNeil possession fifty years prior.","[27, 53]",9.6632
1083433,I Know What You Did Last Summer,"When five friends inadvertently cause a deadly car accident, they cover up their involvement and make a pact to keep it a secret rather than face the consequences. A year later, their past comes back to haunt them and they're forced to confront a horrifying truth: someone knows what they did last summer…and is hell-bent on revenge.","[27, 9648, 53]",12.1254
937278,A Man Called Otto,"When a lively young family moves in next door, grumpy widower Otto Anderson meets his match in a quick-witted, pregnant woman named Marisol, leading to an unlikely friendship that turns his world upside down.","[35, 18]",9.1151
45243,The Hangover Part II,"The Hangover crew heads to Thailand for Stu's wedding. After the disaster of a bachelor party in Las Vegas last year, Stu is playing it safe with a mellow pre-wedding brunch. However, nothing goes as planned and Bangkok is the perfect setting for another adventure with the rowdy group.",[35],10.0807
284053,Thor: Ragnarok,"Thor is imprisoned on the other side of the universe and finds himself in a race against time to get back to Asgard to stop Ragnarok, the destruction of his home-world and the end of Asgardian civilization, at the hands of a powerful new threat, the ruthless Hela.","[28, 12, 878, 35]",12.1263
79871,Crazy Love,"What was supposed to be summer school in England becomes an adventurous exotic and romantic journey for a beautiful teenage girl. [from the Tai Seng Catalog] A nice story of a free-sprited (or, depending on your viewpoint, prick-teasing) young woman on a short journey of discovery.","[35, 10749, 18]",11.193
868759,Ghosted,"Salt-of-the-earth Cole falls head over heels for enigmatic Sadie—but then makes the shocking discovery that she's a secret agent. Before they can decide on a second date, Cole and Sadie are swept away on an international adventure to save the world.","[28, 35, 10749]",10.0137
3981,What Women Want,"Advertising executive Nick Marshall is as cocky as they come, but what happens to a chauvinistic guy when he can suddenly hear what women are thinking? Nick gets passed over for a promotion, but after an accident enables him to hear women's thoughts, he puts his newfound talent to work against Darcy, his new boss, who seems to be infatuated with him.","[35, 10749]",11.7907
127585,X-Men: Days of Future Past,The ultimate X-Men ensemble fights a war for the survival of the species across two time periods as they join forces with their younger selves in an epic battle that must change the past – to save our future.,"[28, 12, 878]",10.4928
10192,Shrek Forever After,"A midlife-crisis burdened Shrek, longing for the days when he felt like a real ogre, makes a pact with magic deal-maker Rumpelstiltskin. But when he's duped and sent to a twisted version of Far Far Away—where Rumpelstiltskin is king, ogres are hunted, and he and Fiona have never met—he sets out to restore his world and reclaim his true love.","[35, 12, 14, 16, 10751]",10.5678
1734,The Mummy Returns,"Rick and Evelyn O’Connell, along with their 8-year-old son Alex, discover the key to the legendary Scorpion King’s might: the fabled Bracelet of Anubis. Unfortunately, a newly resurrected Imhotep has designs on the bracelet as well, and isn’t above kidnapping its new bearer, Alex, to gain control of Anubis’s otherworldly army.","[12, 28, 14]",9.8949
1173558,Burning Betrayal,"Babi discovers a betrayal by her long-term partner and decides to embark on a new adventure in life. On this journey, she meets judge Marco and they begin to live a story permeated by a lot of sexual tension.","[18, 9648, 10749]",9.3989
1062421,Sweet Dreams,"Morris navigates his way through a mandatory stay at Sweet Dreams sober living. In an attempt to get his life back on track, he agrees to coach a misfit softball team of his fellow housemates.",[35],10.8793
1086260,The Astronaut,"After returning from her first space mission, astronaut Sam Walker is placed under NASA’s care at a high security house for rehabilitation and medical testing. However, when disturbing occurrences begin happening around the property, she fears that something extraterrestrial has followed her back to Earth","[878, 27, 53]",11.8731
367112,"Two Women, Two Men","Nick and Charlotte are a married couple. As both are more than busy earning money, there is no time for love or sex - only Tuesdays. Soon, Charlotte finds a lover, Luis, who is an unsuccessful, married artist. He and his wife Eva also have no time for sex, as Eva has to support her artist and the couple's 3 and 6 year old kids by working in a restaurant. The secret affair of Luis and Charlotte lasts quite a while, they decide to spend a romantic week in Venice, Italy. But by accident, Eva finds out about the couple and their destination. She forces Nick, Charlotte's husband, to join her on a trip to Venice in order to restore her marriage as well as his.",[35],7.6039
1181540,Guns Up,"When a job goes horribly wrong, an ex-cop and family man who moonlights as a mob henchman has one night to get his family out of the city.","[28, 35, 80]",11.862
76203,12 Years a Slave,"In the pre-Civil War United States, Solomon Northup, a free black man from upstate New York, is abducted and sold into slavery. Facing cruelty as well as unexpected kindnesses Solomon struggles not only to stay alive, but to retain his dignity. In the twelfth year of his unforgettable odyssey, Solomon’s chance meeting with a Canadian abolitionist will forever alter his life.","[18, 36]",9.1342
639,When Harry Met Sally...,"Sex always gets in the way of friendships between men and women. At least, that's what Harry Burns believes. So when Harry meets Sally Albright and a deep friendship blossoms between them, Harry's determined not to let his attraction to Sally destroy it. But when a night of weakness ends in a morning of panic, can the pair avoid succumbing to Harry's fears by remaining friends and admitting they just might be the perfect match for each other?","[35, 10749, 18]",10.7884
4584,Sense and Sensibility,"The Dashwood sisters, sensible Elinor and passionate Marianne, whose chances at marriage seem doomed by their family's sudden loss of fortune.  When Henry Dashwood dies unexpectedly, his estate must pass on by law to his son from his first marriage, John and wife Fanny. But these circumstances leave Mr. Dashwood's current wife, and daughters Elinor, Marianne and Margaret, without a home and with barely enough money to live on. As Elinor and Marianne struggle to find romantic fulfillment in a society obsessed with financial and social status, they must learn to mix sense with sensibility in their dealings with both money and men.","[18, 10749]",10.4404
151586,La nipote,"The summer vacation of a young beautiful girl, at her uncle's country villa.",[35],10.1168
646,Dr. No,"Agent 007 battles mysterious Dr. No, a scientific genius bent on destroying the U.S. space program. As the countdown to disaster begins, Bond must go to Jamaica, where he encounters beautiful Honey Ryder, to confront a megalomaniacal villain in his massive island headquarters.","[12, 28, 53]",10.4641
316000,Miles Ahead,An exploration of the life and music of Miles Davis.,"[18, 10402, 36]",7.7199
5994,The Family Man,"Jack's lavish, fast-paced lifestyle changes one Christmas night when he stumbles into a grocery store holdup and disarms the gunman. The next morning he wakes up in bed lying next to Kate, his college sweetheart he left in order to pursue his career, and to the horrifying discovery that his former life no longer exists. As he stumbles through this alternate suburban universe, Jack finds himself at a crossroad where he must choose between his high-power career and the woman he loves.","[35, 18, 10749, 14]",12.0144
1220564,The Secret Agent,"In 1977 Brazil, technology specialist Marcelo, fleeing a mysterious past, returns to Recife in search of peace, but realizes the city is far from the refuge he seeks.","[80, 18, 53, 9648]",11.2127
27,9 Songs,"Matt, a young glaciologist, soars across the vast, silent, icebound immensities of the South Pole as he recalls his love affair with Lisa. They meet at a mobbed rock concert in a vast music hall - London's Brixton Academy. They are in bed at night's end. Together, over a period of several months, they pursue a mutual sexual passion whose inevitable stages unfold in counterpoint to nine live-concert songs.","[18, 10402, 10749]",11.905
1218762,Jingle Bell Heist,Two down-on-their-luck hourly workers team up to rob a posh London department store on Christmas Eve. Will they steal each other's hearts along the way?,"[10749, 80, 35]",10.2159
110415,Snowpiercer,"In a future where a failed global-warming experiment kills off most life on the planet, a class system evolves aboard the Snowpiercer; a train that travels around the globe via a perpetual-motion engine.","[28, 878, 18]",10.2068
419430,Get Out,"Chris and his girlfriend Rose go upstate to visit her parents for the weekend. At first, Chris reads the family's overly accommodating behavior as nervous attempts to deal with their daughter's interracial relationship, but as the weekend progresses, a series of increasingly disturbing discoveries lead him to a truth that he never could have imagined.","[9648, 53, 27]",9.5687
419430,Get Out,"Chris and his girlfriend Rose go upstate to visit her parents for the weekend. At first, Chris reads the family's overly accommodating behavior as nervous attempts to deal with their daughter's interracial relationship, but as the weekend progresses, a series of increasingly disturbing discoveries lead him to a truth that he never could have imagined.","[9648, 53, 27]",9.5687
1136867,Materialists,"A young, ambitious New York City matchmaker finds herself torn between the perfect match and her imperfect ex.","[10749, 18]",9.6636
278927,The Jungle Book,"A man-cub named Mowgli fostered by wolves. After a threat from the tiger Shere Khan, Mowgli is forced to flee the jungle, by which he embarks on a journey of self discovery with the help of the panther, Bagheera and the free-spirited bear, Baloo.","[10751, 12, 14]",10.0491
660,Thunderball,A criminal organization has obtained two nuclear bombs and are asking for a 100 million pound ransom in the form of diamonds in seven days or they will use the weapons. The secret service sends James Bond to the Bahamas to once again save the world.,"[12, 28, 53]",15.3173
9387,Conan the Barbarian,"A horde of rampaging warriors massacre the parents of young Conan and enslave the young child for years on The Wheel of Pain. As the sole survivor of the childhood massacre, Conan is released from slavery and taught the ancient arts of fighting. Transforming himself into a killing machine, Conan travels into the wilderness to seek vengeance on Thulsa Doom, the man responsible for killing his family. In the wilderness, Conan takes up with the thieves Valeria and Subotai. The group comes upon King Osric, who wants the trio of warriors to help rescue his daughter who has joined Doom in the hills.","[12, 14, 28]",10.8784
579974,RRR,A fictional history of two legendary revolutionaries' journey away from home before they began fighting for their country in the 1920s.,"[28, 12, 18]",13.0653
11395,The Santa Clause,"On Christmas Eve, divorced dad Scott Calvin and his son discover Santa Claus has fallen off their roof. When Scott takes the reins of the magical sleigh, he finds he is now the new Santa, and must convince a world of disbelievers, including himself.","[14, 18, 35, 10751]",10.9629
27098,All Things Fair,"Stig is a 15-year-old pupil of 37-year-old teacher Viola. He is attracted by her beauty and maturity while she is drawn to him by his youth and innocence, a relief from her drunk and miserable husband.","[18, 10749, 10752]",13.4592
26037,Into Temptation,"When a suicidal prostitute confesses to a priest her plans to end her life on her birthday, he searches for her to intervene.","[18, 9648]",9.5792
28468,The Key,"Art professor Nino Rolfe attempts to break down his wife Teresa's conventional modesty. Noticing her affection for their daughter's fiancé, Nino instigates her sexual interest in him - setting off a chain of unexpected events and emotional complications...","[18, 10749]",10.3109
8960,Hancock,"Hancock is a down-and-out superhero who's forced to employ a PR expert to help repair his image when the public grows weary of all the damage he's inflicted during his lifesaving heroics. The agent's idea of imprisoning the antihero to make the world miss him proves successful, but will Hancock stick to his new sense of purpose or slip back into old habits?","[14, 28]",7.5925
843527,The Idea of You,"40-year-old single mom Solène begins an unexpected romance with 24-year-old Hayes Campbell, the lead singer of August Moon, the hottest boy band on the planet. As they begin a whirlwind romance, it isn't long before Hayes' superstar status poses unavoidable challenges to their relationship, and Solène soon discovers that life in the glare of his spotlight might be more than she bargained for.","[10749, 18, 35]",9.9833
842924,The Life of Chuck,"In this extraordinary story of an ordinary man, Charles 'Chuck' Krantz experiences the wonder of love, the heartbreak of loss, and the multitudes contained in all of us.","[14, 18]",12.2936
4248,Scary Movie 2,"While the original parodied slasher flicks like Scream, Keenen Ivory Wayans's sequel to Scary Movie takes comedic aim at haunted house movies. A group of students visit a mansion called ""Hell House,"" and murderous high jinks ensue.",[35],8.6369
713704,Evil Dead Rise,"A reunion between two estranged sisters gets cut short by the rise of flesh-possessing demons, thrusting them into a primal battle for survival as they face the most nightmarish version of family imaginable.","[27, 53]",10.4706
1216571,June and John,John leads an ordinary life with a monotonous routine. One day John runs into a woman on the subway who is as beautiful as she is mysterious named June. His encounter with her finally leads him to have a goal in his bumptious life.,"[10749, 53]",10.7988
863,Toy Story 2,"Andy heads off to Cowboy Camp, leaving his toys to their own devices. Things shift into high gear when an obsessive toy collector named Al McWhiggen, owner of Al's Toy Barn kidnaps Woody. Andy's toys mount a daring rescue mission, Buzz Lightyear meets his match and Woody has to decide where he and his heart truly belong.","[16, 35, 10751]",17.6503
4347,Atonement,"As a 13-year-old, fledgling writer Briony Tallis irrevocably changes the course of several lives when she accuses her older sister's lover of a crime he did not commit.","[18, 10749]",8.6774
286217,The Martian,"During a manned mission to Mars, Astronaut Mark Watney is presumed dead after a fierce storm and left behind by his crew. But Watney has survived and finds himself stranded and alone on the hostile planet. With only meager supplies, he must draw upon his ingenuity, wit and spirit to subsist and find a way to signal to Earth that he is alive.","[18, 12, 878]",10.7203
718930,Bullet Train,"Unlucky assassin Ladybug is determined to do his job peacefully after one too many gigs gone off the rails. Fate, however, may have other plans, as Ladybug's latest mission puts him on a collision course with lethal adversaries from around the globe—all with connected, yet conflicting, objectives—on the world's fastest train.","[28, 35, 53]",10.487
