movie_id,title,overview,genre_ids,popularity
798645,The Running Man,"Desperate to save his sick daughter, working-class Ben Richards is convinced by The Running Man's charming but ruthless producer to enter the deadly competition game as a last resort. But Ben's defiance, instincts, and grit turn him into an unexpected fan favorite — and a threat to the entire system. As ratings skyrocket, so does the danger, and Ben must outwit not just the Hunters, but a nation addicted to watching him fall.","[28, 53, 878]",418.0257
1084242,Zootopia 2,"After cracking the biggest case in Zootopia's history, rookie cops Judy Hopps and Nick Wilde find themselves on the twisting trail of a great mystery when Gary De’Snake arrives and turns the animal metropolis upside down. To crack the case, Judy and Nick must go undercover to unexpected new parts of town, where their growing partnership is tested like never before.","[16, 35, 12, 10751, 9648]",382.4108
1223601,Sisu: Road to Revenge,"Returning to the house where his family was brutally murdered during the war, ‘the man who refuses to die’ dismantles it, loads it on a truck, and is determined to rebuild it somewhere safe in their honor. When the commander who killed his family comes back hellbent on finishing the job, a relentless, eye-popping cross-country chase ensues.","[28, 10752]",386.9594
812583,Wake Up Dead Man: A Knives Out Mystery,"When young priest Jud Duplenticy is sent to assist charismatic firebrand Monsignor Jefferson Wicks, it’s clear that all is not well in the pews. After a sudden and seemingly impossible murder rocks the town, the lack of an obvious suspect prompts local police chief Geraldine Scott to join forces with renowned detective Benoit Blanc to unravel a mystery that defies all logic.","[53, 9648, 35]",344.9733
1387382,Hunting Season,"When a reclusive survivalist and his daughter rescue a mysterious, wounded woman from a river, they become entangled in a deadly web of violence and revenge, forcing them to confront a brutal criminal to survive.","[28, 18, 53]",227.3166
1217602,London Calling,"After fleeing the UK from a job gone wrong, a down on his luck hitman is forced to babysit the son of his new crime boss and show him how to become a man.","[28, 80, 35, 53]",229.9008
1149167,High Rollers,"A master thief must pull off a dangerous casino heist when his nemesis kidnaps his lover. Caught between rival criminals and FBI pursuit, he risks all to save her and score big.","[28, 80, 53]",179.4486
83533,Avatar: Fire and Ash,"In the wake of the devastating war against the RDA and the loss of their eldest son, Jake Sully and Neytiri face a new threat on Pandora: the Ash People, a violent and power-hungry Na'vi tribe led by the ruthless Varang. Jake's family must fight for their survival and the future of Pandora in a conflict that pushes them to their emotional and physical limits.","[878, 12, 14]",211.4017
533533,TRON: Ares,"A highly sophisticated Program called Ares is sent from the digital world into the real world on a dangerous mission, marking humankind's first encounter with A.I. beings.","[878, 12, 28]",180.7952
1228246,Five Nights at Freddy's 2,"One year since the supernatural nightmare at Freddy Fazbear's Pizza, the stories about what transpired there have been twisted into a campy local legend, inspiring the town's first ever Fazfest. With the truth kept from her, Abby sneaks out to reconnect with Freddy, Bonnie, Chica, and Foxy, setting into motion a terrifying series of events that will reveal dark secrets about the real origin of Freddy's, and unleash a decades-hidden horror.","[27, 53]",186.3681
1180831,Troll 2,"When a dangerous new troll unleashes devastation across their homeland, Nora, Andreas and Major Kris embark on their most perilous mission yet.","[28, 14, 53]",156.6819
1218925,Chainsaw Man - The Movie: Reze Arc,"In a brutal war between devils, hunters, and secret enemies, a mysterious girl named Reze has stepped into Denji's world, and he faces his deadliest battle yet, fueled by love in a world where survival knows no rules.","[16, 28, 10749, 14]",157.2924
1083637,Kantara - A Legend: Chapter 1,"During the Kadamba reign, King Vijayendra, the ruler of the fictional feudatory land of Bangra, meets his final fate while venturing into the mystical forest of Kantara. Witnessing this, his son Rajashekara seals the borders of their realm. Later, Prince Kulashekara reopens them through a brutal massacre. The protagonist, Berme, in search of prosperity, crosses the divide and ignites a conflict of faith, power, and destiny between the Kingdom and Nature.","[28, 18, 14]",133.7183
755898,War of the Worlds,"Will Radford is a top analyst for Homeland Security who tracks potential threats through a mass surveillance program, until one day an attack by an unknown entity leads him to question whether the government is hiding something from him... and from the rest of the world.","[878, 53]",143.4004
1242898,Predator: Badlands,"Cast out from his clan, a young Predator finds an unlikely ally in a damaged android and embarks on a treacherous journey in search of the ultimate adversary.","[28, 878, 12]",135.7866
1379963,Tell Me Softly,"Kamila has everything under control: studies, social life, her image... Everything except the unexpected return of her neighbors, the Di Bianco brothers, after seven years of absence. Thiago stole her first kiss, and Taylor was her best friend, but now their return will turn Kami's world upside down. Can the three overcome the past that binds them? Or will everything explode into pieces once again?","[10749, 18]",123.1847
980477,Ne Zha 2,"After a catastrophic event leaves their bodies destroyed, Ne Zha and Ao Bing are granted a fragile second chance at life. As tensions rise between the dragon clans and celestial forces, the two must undergo a series of perilous trials that will test their bond, challenge their identities, and decide the fate of both mortals and immortals.","[16, 14, 12, 28]",118.1511
1196067,Worldbreaker,"Five years ago, a tear in the fabric of reality brought creatures to our world from an alternate dimension bent on our destruction. A father hides his daughter on an island to keep her safe while he prepares her for survival and the battles to come. But when the world is about to break, no place is safe.","[878, 28]",242.8591
1419406,The Shadow's Edge,Macau Police brings the tracking expert police officer out of retirement to help catch a dangerous group of professional thieves.,"[28, 80, 53]",130.6248
1422096,Good Boy,"A loyal dog moves to a rural family home with his owner Todd, only to discover supernatural forces lurking in the shadows. As dark entities threaten his human companion, the brave pup must fight to protect the one he loves most.","[27, 53]",109.5989
425274,Now You See Me: Now You Don't,"The original Four Horsemen reunite with a new generation of illusionists to take on powerful diamond heiress Veronika Vanderberg, who leads a criminal empire built on money laundering and trafficking. The new and old magicians must overcome their differences to work together on their most ambitious heist yet.","[53, 80, 9648]",447.1739
1033462,Bureau 749,A traumatized young man with physical abnormalities is forced to join a mysterious bureau to confront a disaster spreading across the earth caused by an unknown creature. He embarks on an adventure uncovering mysteries about his life.,"[28, 12, 878]",102.956
23527,First Squad: The Moment of Truth,Set during the opening days of World War II on the Eastern Front. Its main cast are a group of Soviet teenagers with extraordinary abilities; the teenagers have been drafted to form a special unit to fight the invading German army. They are opposed by a Schutzstaffel officer who is attempting to raise from the dead a supernatural army of crusaders from the 12th-century Order of the Sacred Cross.,"[14, 16, 28, 878]",91.2143
1286185,The Carpenter's Son,"A remote village in Roman-era Egypt explodes into spiritual warfare when a carpenter, his wife and their child are targeted by supernatural forces.",[27],88.8767
1448560,Wildcat,An ex-black ops team reunite to pull off a desperate heist in order to save the life of their leader’s eight-year-old daughter.,"[28, 53, 80]",90.4248
1246049,Dracula,"When a 15th-century prince denounces God after the devastating loss of his wife, he inherits an eternal curse: he becomes Dracula. Condemned to wander the centuries, he defies fate and death itself, guided by a single hope — to be reunited with his lost love.","[27, 14, 10749]",91.1345
1291608,Dhurandhar,An Indian intelligence mission unfolds over ten years as an undercover agent enters Karachi's criminal and political world to dismantle dangerous cross-border terror networks.,"[28, 53]",96.8733
1311031,Demon Slayer: Kimetsu no Yaiba Infinity Castle,"The Demon Slayer Corps are drawn into the Infinity Castle, where Tanjiro, Nezuko, and the Hashira face terrifying Upper Rank demons in a desperate fight as the final battle against Muzan Kibutsuji begins.","[16, 28, 14]",93.7567
1062722,Frankenstein,"Dr. Victor Frankenstein, a brilliant but egotistical scientist, brings a creature to life in a monstrous experiment that ultimately leads to the undoing of both the creator and his tragic creation.","[18, 14, 27]",86.3072
1288072,Keeper,"Liz and Malcolm escape for a romantic anniversary weekend at a secluded cabin. When Malcolm suddenly returns to the city, Liz finds herself isolated and in the presence of an unspeakable evil that reveals the cabin's horrifying secrets.","[27, 9648]",76.2668
1033148,Die My Love,"Grace and her partner Jackson move into an old country house. She pursues her dream of writing, and the couple welcome a baby soon after. However, with Jackson frequently absent, and the pressures of domestic life weighing on her, Grace begins to unravel, leaving a path of destruction in her wake.","[18, 53]",72.6421
269149,Zootopia,"Determined to prove herself, Officer Judy Hopps, the first bunny on Zootopia's police force, jumps at the chance to crack her first case - even if it means partnering with scam-artist fox Nick Wilde to solve the mystery.","[16, 12, 10751, 35]",82.3856
152760,The Monuments Men,"Based on the true story of the greatest treasure hunt in history, The Monuments Men is an action drama focusing on seven over-the-hill, out-of-shape museum directors, artists, architects, curators, and art historians who went to the front lines of WWII to rescue the world’s artistic masterpieces from Nazi thieves and return them to their rightful owners.  With the art hidden behind enemy lines, how could these guys hope to succeed?","[10752, 18, 36, 28]",84.5369
967941,Wicked: For Good,"As an angry mob rises against the Wicked Witch, Glinda and Elphaba will need to come together one final time. With their singular friendship now the fulcrum of their futures, they will need to truly see each other, with honesty and empathy, if they are to change themselves, and all of Oz, for good.","[14, 12, 10749]",78.6601
7451,xXx,"Xander Cage is your standard adrenaline junkie with no fear and a lousy attitude. When the US Government ""recruits"" him to go on a mission, he's not exactly thrilled. His mission: to gather information on an organization that may just be planning the destruction of the world, led by the nihilistic Yorgi.","[28, 12, 53, 80, 18]",81.5551
1162858,The Other,"Unable to conceive, a couple seeks to build a family with a young orphan, survivor of tragic childhood. But their act of love turns to horror when they realize the violence in their foster's past has returned to destroy the new family.","[27, 53]",109.0813
949709,High Forces,"""Anyone? There is ......"" A mysterious message from Gao Haojun comes from ten thousand meters in the air. A five-star A380 ultra-luxury airliner was hijacked on its international maiden voyage, and international security expert Gao Haojun stood up to a group of thugs, his daughter Xiaojun was trapped in the cabin, and Mike, the leader of the hijackers, threatened the lives of more than 800 people in the plane as a bargaining chip, and Xiaojun's mother, Fu Yuan, was also in danger. ...... Will the passengers on board be able to land safely and how should this crisis be resolved?","[28, 80]",70.8558
1363123,The Family Plan 2,"Now that Dan's assassin days are behind him, all he wants for Christmas is quality time with his kids. But when he learns his daughter has her own plans, he books a family trip to London—putting them all in the crosshairs of an unexpected enemy.","[28, 35]",68.9502
1539104,JUJUTSU KAISEN: Execution -Shibuya Incident x The Culling Game Begins-,"A veil abruptly descends over the busy Shibuya area amid the bustling Halloween crowds, trapping countless civilians inside. Satoru Gojo, the strongest jujutsu sorcerer, steps into the chaos. But lying in wait are curse users and spirits scheming to seal him away. Yuji Itadori, accompanied by his classmates and other top-tier jujutsu sorcerers, enters the fray in an unprecedented clash of curses — the Shibuya Incident. In the aftermath, ten colonies across Japan are transformed into dens of curses in a plan orchestrated by Noritoshi Kamo. As the deadly Culling Game starts, Special Grade sorcerer Yuta Okkotsu is assigned to carry out Yuji's execution for his perceived crimes. A compilation movie of Shibuya Incident including the first two episodes of the Culling Games arc.","[16, 28]",69.3131
1523145,Your Heart Will Be Broken,"High school student Polina is saved from bullying at her new school and makes a deal with the main bully Bars: he must pretend to be her boyfriend and protect her, and she must do everything he says. During this game, the couple develops real feelings, but her family and classmates have reasons to separate the lovers.",[10749],65.0104
803796,KPop Demon Hunters,"When K-pop superstars Rumi, Mira and Zoey aren't selling out stadiums, they're using their secret powers to protect their fans from supernatural threats.","[14, 10402, 35, 16]",68.007
974663,200% Wolf,"When Freddy Lupin's wayward wish transforms him into a werewolf and deposits a mischievous moon sprite on Earth, Freddy must restore the cosmic order before the earth and moon collide.","[16, 12, 14, 10751, 28, 35]",67.8825
1309012,Altered,"In an alternate present, genetically enhanced humans dominate society. Outcasts Leon and Chloe fight for justice against corrupt politicians exploiting genetic disparity, risking everything to challenge the oppressive system.","[878, 28]",66.1953
617126,The Fantastic 4: First Steps,"Against the vibrant backdrop of a 1960s-inspired, retro-futuristic world, Marvel's First Family is forced to balance their roles as heroes with the strength of their family bond, while defending Earth from a ravenous space god called Galactus and his enigmatic Herald, Silver Surfer.","[878, 12, 28]",54.9009
1054867,One Battle After Another,"Washed-up revolutionary Bob exists in a state of stoned paranoia, surviving off-grid with his spirited, self-reliant daughter, Willa. When his evil nemesis resurfaces after 16 years and she goes missing, the former radical scrambles to find her, father and daughter both battling the consequences of his past.","[53, 80, 28]",62.0856
346364,It,"In a small town in Maine, seven children known as The Losers Club come face to face with life problems, bullies and a monster that takes the shape of a clown called Pennywise.","[27, 53]",66.0021
1429520,Sidelined 2: Intercepted,"Freshman star quarterback Drayton struggles with the weight of expectations after a devastating setback, while dancer Dallas begins to question the future she thought she wanted. As their high school relationship begins to unravel under the pressures of distance and self-discovery, they’ll learn that the bravest versions of themselves emerge when they let life redirect them.","[10749, 35]",60.2398
575265,Mission: Impossible - The Final Reckoning,"Ethan Hunt and team continue their search for the terrifying AI known as the Entity — which has infiltrated intelligence networks all over the globe — with the world's governments and a mysterious ghost from Hunt's past on their trail. Joined by new allies and armed with the means to shut the Entity down for good, Hunt is in a race against time to prevent the world as we know it from changing forever.","[28, 53]",60.6245
507089,Five Nights at Freddy's,"Recently fired and desperate for work, a troubled young man named Mike agrees to take a position as a night security guard at an abandoned theme restaurant: Freddy Fazbear's Pizzeria. But he soon discovers that nothing at Freddy's is what it seems.","[27, 53]",54.0437
19995,Avatar,"In the 22nd century, a paraplegic Marine is dispatched to the moon Pandora on a unique mission, but becomes torn between following orders and protecting an alien civilization.","[28, 12, 14, 878]",62.2412
1116465,A Legend,An archeologist noticed that the texture of the relics discovered during the excavation of a glacier closely resembled a jade pendant seen in one of his dreams. He and his team then embark on an expedition into the depths of the glacier.,"[28, 12, 14]",55.7558
785663,Old Henry,"A widowed farmer and his son warily take in a mysterious, injured man with a satchel of cash. When a posse of men claiming to be the law come for the money, the farmer must decide who to trust. Defending a siege of his homestead, the farmer reveals a talent for gun-slinging that surprises everyone calling his true identity into question.","[37, 28, 18]",9.8566
76600,Avatar: The Way of Water,"Set more than a decade after the events of the first film, learn the story of the Sully family (Jake, Neytiri, and their kids), the trouble that follows them, the lengths they go to keep each other safe, the battles they fight to stay alive, and the tragedies they endure.","[28, 12, 878]",62.6713
1255775,Merv,"When their beloved dog Merv loses his spark after their split, Anna and Russ are forced into the world's most awkward co-parenting arrangement. Hoping to shake Merv out of his funk, Russ takes him to Florida for a much-needed getaway-only for Anna to show up unexpectedly. As Merv slowly gets his groove back, turns out fixing their dog's broken heart may lead to a few sparks of their own.","[35, 10749]",43.3719
1196573,She Rides Shotgun,"Newly released from prison and marked for death by unrelenting enemies, Nate must now protect his estranged 11-year-old daughter, Polly, at all costs. With scant resources and no one to trust, Nate and Polly forge a bond under fire as he shows her how to fight and survive—and she teaches him the true meaning of unconditional love.","[28, 53, 80]",52.5882
1061474,Superman,"Superman, a journalist in Metropolis, embarks on a journey to reconcile his Kryptonian heritage with his human upbringing as Clark Kent.","[878, 12, 28]",50.8257
701387,Bugonia,"Two conspiracy obsessed young men kidnap the high-powered CEO of a major company, convinced that she is an alien intent on destroying planet Earth.","[878, 80]",57.6197
474350,It Chapter Two,"27 years after overcoming the malevolent supernatural entity Pennywise, the former members of the Losers' Club, who have grown up and moved away from Derry, are brought back together by a devastating phone call.","[27, 53]",53.4608
601,E.T. the Extra-Terrestrial,"An alien is left behind on Earth and saved by the 10-year-old Elliott who decides to keep him hidden in his home. While a task force hunts for the extra-terrestrial, Elliott, his brother, and his little sister Gertie form an emotional bond with their new friend, and try to help him find his way home.","[878, 12, 10751, 14]",56.3582
1561955,Stephen,"A psychiatrist evaluating a self-confessed serial killer unravels a twisted web of trauma, deceit, and psychological manipulation—only to question if the killer is truly guilty or just another victim in a larger, darker game.",[53],42.7929
1038392,The Conjuring: Last Rites,Paranormal investigators Ed and Lorraine Warren take on one last terrifying case involving mysterious entities they must confront.,[27],49.9261
1342341,Captain Sabertooth and the Countess of Grel,"Set sail for an exciting pirate adventure when Captain Sabertooth and Raven fight against Sibylla and her terrifying dragon in a battle that can only be won by courage, friendship and rat soup!","[16, 10751, 12]",50.2767
1234821,Jurassic World Rebirth,"Five years after the events of Jurassic World Dominion, covert operations expert Zora Bennett is contracted to lead a skilled team on a top-secret mission to secure genetic material from the world's three most massive dinosaurs. When Zora's operation intersects with a civilian family whose boating expedition was capsized, they all find themselves stranded on an island where they come face-to-face with a sinister, shocking discovery that's been hidden from the world for decades.","[878, 12, 28]",46.2344
1318691,Los Muértimer,It tells the story of five friends who discover a jewel theft plot in a cemetery without any adult believing them.,"[35, 27, 9648, 10751]",57.1659
911430,F1,Racing legend Sonny Hayes is coaxed out of retirement to lead a struggling Formula 1 team—and mentor a young hotshot driver—while chasing one more chance at glory.,"[28, 18]",45.9023
1197137,Black Phone 2,"Four years after escaping The Grabber, Finney Blake is struggling with his life after captivity. When his sister Gwen begins receiving calls in her dreams from the black phone and seeing disturbing visions of three boys being stalked at a winter camp, the siblings become determined to solve the mystery and confront a killer who has grown more powerful in death and more significant to them than either could imagine.","[27, 53]",48.975
1469354,Border Hunters,"After his police officer brother is killed by a drug dealer who flees to the protection of his cartel-connected uncle in Mexico, an American man with a diverse law enforcement/military background goes south of the border to get revenge","[28, 53]",43.2961
1166133,Bramayugam,"A folk singer in 17th-century Kerala discovers a mansion. Inside, he encounters an enigmatic cook and a powerful master, setting in motion a chain of events that changes his life.","[27, 53, 18]",43.3932
1087192,How to Train Your Dragon,"On the rugged isle of Berk, where Vikings and dragons have been bitter enemies for generations, Hiccup stands apart, defying centuries of tradition when he befriends Toothless, a feared Night Fury dragon. Their unlikely bond reveals the true nature of dragons, challenging the very foundations of Viking society.","[14, 10751, 28, 12]",49.9986
238,The Godfather,"Spanning the years 1945 to 1955, a chronicle of the fictional Italian-American Corleone crime family. When organized crime family patriarch, Vito Corleone barely survives an attempt on his life, his youngest son, Michael steps in to take care of the would-be killers, launching a campaign of bloody revenge.","[18, 80]",47.9109
1130276,Succubus,A new father going through a marital separation joins a dating app and matches with a beautiful but mysterious young woman... whose powers of seduction and manipulation entangle him in a mystery more horrifying than he could have ever imagined.,"[27, 53]",41.9459
1275779,Disclosure Day,"If you found out we weren’t alone in the universe, would that frighten you?","[878, 53]",46.5794
24428,The Avengers,"When an unexpected enemy emerges and threatens global safety and security, Nick Fury, director of the international peacekeeping agency known as S.H.I.E.L.D., finds himself in need of a team to pull the world back from the brink of disaster. Spanning the globe, a daring recruitment effort begins!","[878, 28, 12]",50.433
1208561,Art of Eight Limbs,Four canisters of deadly VX nerve gas have fallen into the hands of an international arms dealer in Myanmar. A CIA recruit delivers a high-tech detection device to an agent already on the ground.,"[28, 53]",42.7891
1507275,A Paw Patrol Christmas,"Rubble is looking forward to Santa bringing him a new laser drill, but finds that Santa has come down with a cold and can’t deliver any presents. When Mayor Humdinger decides he’s going to the North Pole to take all the gifts for himself, it’s up to the PAW Patrol to stop him.","[16, 10751, 12]",42.9394
157336,Interstellar,The adventures of a group of explorers who make use of a newly discovered wormhole to surpass the limitations on human space travel and conquer the vast distances involved in an interstellar voyage.,"[12, 18, 878]",47.3964
8871,How the Grinch Stole Christmas,The Grinch decides to rob Whoville of Christmas - but a dash of kindness from little Cindy Lou Who and her family may be enough to melt his heart...,"[10751, 35, 14]",42.9034
1010581,My Fault,"Noah must leave her city, boyfriend, and friends to move into William Leister's mansion, the flashy and wealthy husband of her mother Rafaela. As a proud and independent 17 year old, Noah resists living in a mansion surrounded by luxury. However, it is there where she meets Nick, her new stepbrother, and the clash of their strong personalities becomes evident from the very beginning.","[18, 10749, 53]",42.6243
546554,Knives Out,"When renowned crime novelist Harlan Thrombey is found dead at his estate just after his 85th birthday, the inquisitive and debonair Detective Benoit Blanc is mysteriously enlisted to investigate. From Harlan's dysfunctional family to his devoted staff, Blanc sifts through a web of red herrings and self-serving lies to uncover the truth behind Harlan's untimely death.","[35, 80, 9648]",45.8892
415747,Velvet Dreams,,[18],40.2755
