movie_id,title,overview,genre_ids,popularity
203151,The Sanatorium,"A group of friends decide to make a documentary about the ghosts that are supposed to be haunting The Sanatorium in Costa Rica, things get creepy when the arrive to the place.","[27, 35]",14.0351
82675,Taken 2,"In Istanbul, retired CIA operative Bryan Mills and his wife are taken hostage by the father of a kidnapper Mills killed while rescuing his daughter.","[28, 80, 53]",14.0268
429,"The Good, the Bad and the Ugly","While the Civil War rages on between the Union and the Confederacy, three men – a quiet loner, a ruthless hitman, and a Mexican bandit – comb the American Southwest in search of a strongbox containing $200,000 in stolen gold.",[37],14.0037
5955,The Pledge,"A police chief, about to retire, pledges to help a woman find her daughter's killer.","[80, 18, 9648, 53]",13.9991
953,Madagascar,Four animal friends get a taste of the wild life when they break out of captivity at the Central Park Zoo and wash ashore on the island of Madagascar.,"[10751, 16, 12, 35]",13.996
228150,Fury,"April, 1945. As the Allies make their final push in the European Theatre, a battle-hardened army sergeant named Wardaddy commands a Sherman tank and her five-man crew on a deadly mission behind enemy lines. Outnumbered and outgunned, and with a rookie soldier thrust into their platoon, Wardaddy and his men face overwhelming odds in their heroic attempts to strike at the heart of Nazi Germany.","[10752, 18, 28]",14.031
12153,White Chicks,"Two FBI agent brothers, Marcus and Kevin Copeland, accidentally foil a drug bust. To avoid being fired they accept a mission escorting a pair of socialites to the Hamptons--but when the girls are disfigured in a car accident, they refuse to go. Left without options, Marcus and Kevin decide to pose as the sisters, transforming themselves from black men into rich white women.","[35, 80]",13.9907
14035,Meatballs,"Tripper is the head counselor at a budget summer camp called Camp Northstar. In truth, he's young at heart and only marginally more mature than the campers themselves. Tripper befriends Rudy, a loner camper who has trouble fitting in. As Tripper inspires his young charges to defeat rival Camp Mohawk in the annual Olympiad competition, Rudy plays matchmaker between Tripper and Roxanne, a female counselor at Northstar.",[35],13.9876
1072699,Inside Furioza,"In the wake of murder, new Furioza leader Golden claims the reins of his violent and formidable hooligan gang and takes on a new focus across borders.","[28, 80, 53]",13.9843
1160018,Kill,"When an army commando finds out his true love is engaged against her will, he boards a New Dehli-bound train in a daring quest to derail the arranged marriage. But when a gang of knife-wielding thieves begin to terrorize innocent passengers on his train, the commando takes them on, one by one.","[28, 80, 53, 18]",13.9635
297802,Aquaman,"Half-human, half-Atlantean Arthur Curry is taken on the journey of his lifetime to discover if he is worth of being a king.","[28, 12, 14]",13.9531
11881,Miracle on 34th Street,"Kris Kringle, seemingly the embodiment of Santa Claus, is asked to portray the jolly old fellow at Macy's following his performance in the Thanksgiving Day parade. His portrayal is so complete that many begin to question if he truly is Santa Claus, while others question his sanity.","[35, 18, 10751]",13.9302
1134278,Pacific Fear,A surf vacation turns into a nightmare when a group of surfers go looking for waves on a mysterious island that isn't on any map.,"[27, 53]",13.9265
1143190,Fear the Night,"During a bachelorette party in a secluded California farmhouse, masked intruders launch a brutal attack, forcing eight women to fight for survival. Led by Tess, a troubled military veteran, they unite to defend themselves throughout a harrowing night.","[28, 53, 27]",13.8978
603692,John Wick: Chapter 4,"With the price on his head ever increasing, John Wick uncovers a path to defeating The High Table. But before he can earn his freedom, Wick must face off against a new enemy with powerful alliances across the globe and forces that turn old friends into foes.","[28, 53, 80]",13.8976
1125257,Freakier Friday,"Years after Tess and Anna endured an identity crisis, Anna now has a daughter of her own and a soon-to-be stepdaughter. As they navigate the myriad challenges that come when two families merge, Tess and Anna discover lightning might indeed strike twice.","[35, 14, 10751]",13.8898
726139,Project Silence,"Due to sudden deteriorating weather conditions, visibility on the Airport Bridge is severely impaired, leaving people stranded and at risk of the bridge collapsing due to a series of chain collisions and explosions. Amidst the chaos, the canine subjects ""Echo"" from the military experiment ""Project Silence,"" who were being transported in secret, break free, and all human survivors become targets of relentless attacks.","[53, 28, 27, 878, 12]",13.8684
11224,Cinderella,"Cinderella has faith her dreams of a better life will come true. With help from her loyal mice friends and a wave of her Fairy Godmother's wand, Cinderella's rags are magically turned into a glorious gown and off she goes to the Royal Ball. But when the clock strikes midnight, the spell is broken, leaving a single glass slipper... the only key to the ultimate fairy-tale ending!","[10751, 14, 16, 10749]",12.0789
450465,Glass,"In a series of escalating encounters, former security guard David Dunn uses his supernatural abilities to track Kevin Wendell Crumb, a disturbed man who has twenty-four personalities. Meanwhile, the shadowy presence of Elijah Price emerges as an orchestrator who holds secrets critical to both men.","[53, 18, 878]",9.999
588228,The Tomorrow War,"The world is stunned when a group of time travelers arrive from the year 2051 to deliver an urgent message: Thirty years in the future, mankind is losing a global war against a deadly alien species. The only hope for survival is for soldiers and civilians from the present to be transported to the future and join the fight. Among those recruited is high school teacher and family man Dan Forester. Determined to save the world for his young daughter, Dan teams up with a brilliant scientist and his estranged father in a desperate quest to rewrite the fate of the planet.","[28, 878, 12]",13.0395
1402404,O Shaolin do Sertão 2 - A Voadora 360º,,[],11.6011
1320414,The Witness,"In Iran, the retired dance teacher Tarlan witnesses her friend Rana's murder by her husband, who is an important government figure. When the police refuse to investigate, Tarlan must decide whether to bow to political pressure or risk her reputation and livelihood in pursuit of justice.",[18],12.2754
324857,Spider-Man: Into the Spider-Verse,"Struggling to find his place in the world while juggling school and family, Brooklyn teenager Miles Morales is unexpectedly bitten by a radioactive spider and develops unfathomable powers just like the one and only Spider-Man. While wrestling with the implications of his new abilities, Miles discovers a super collider created by the madman Wilson ""Kingpin"" Fisk, causing others from across the Spider-Verse to be inadvertently transported to his dimension.","[16, 28, 12, 878]",14.5329
13189,A Christmas Carol,"Miser Ebenezer Scrooge is awakened on Christmas Eve by spirits who reveal to him his own miserable existence, what opportunities he wasted in his youth, his current cruelties, and the dire fate that awaits him if he does not change his ways. Scrooge is faced with his own story of growing bitterness and meanness, and must decide what his own future will hold: death or redemption.","[18, 14, 10770, 10751]",13.2165
109418,Grown Ups 2,"Lenny has relocated his family back to the small town where he and his friends grew up. This time around, the grown ups are the ones learning lessons from their kids on a day notoriously full of surprises—the last day of school.",[35],11.6189
1548017,The Family McMullen,"30 years after the events of The Brothers McMullen, romantic entanglements plague a now fiftysomething Barry McMullen and his twentysomething kids, as well as his brother Patrick and widowed sister-in-law Molly, who are also facing similar unexpected hurdles.","[18, 35]",11.8464
9479,The Nightmare Before Christmas,"Tired of scaring humans every October 31 with the same old bag of tricks, Jack Skellington, the spindly king of Halloween Town, kidnaps Santa Claus and plans to deliver shrunken heads and other ghoulish gifts to children on Christmas morning. But as Christmas approaches, Jack's rag-doll girlfriend, Sally, tries to foil his misguided plans.","[14, 16, 10751]",14.5341
648878,Eddington,"In May of 2020, a standoff between a small-town sheriff and mayor sparks a powder keg as neighbor is pitted against neighbor in Eddington, New Mexico.","[37, 35, 80]",13.4418
1215798,The Cut,"A retired boxer intends to return to the ring for one last shot at the title, but first he must make the weight. Holed up in a room in Las Vegas with an unscrupulous trainer, he embarks on an intensive and illegal weight-cutting program.","[53, 18]",13.4356
296096,Me Before You,"A small town girl is caught between dead-end jobs. A high-profile, successful man becomes wheelchair bound following an accident. The man decides his life is not worth living until the girl is hired for six months to be his new caretaker. Worlds apart and trapped together by circumstance, the two get off to a rocky start. But the girl becomes determined to prove to the man that life is worth living and as they embark on a series of adventures together, each finds their world changing in ways neither of them could begin to imagine.","[18, 10749]",14.094
801335,Girl in the Basement,"Sara is a teen girl who is looking forward to her 18th birthday to move away from her controlling father Don. But before she could even blow out the candles, Don imprisons her in the basement of their home.","[53, 80, 10770]",13.496
516729,Paddington in Peru,"Paddington travels to Peru to visit his beloved Aunt Lucy, who now resides at the Home for Retired Bears. With the Brown Family in tow, a thrilling adventure ensues when a mystery plunges them into an unexpected journey through the Amazon rainforest and up to the mountain peaks of Peru.","[10751, 35, 12]",11.3574
28501,The Pit and the Pendulum,"In the sixteenth century, Francis Barnard travels to Spain to clarify the strange circumstances of his sister's death after she had married the son of a cruel Spanish Inquisitor.","[27, 9648, 18]",8.0755
85511,California Dreaming,"Young T.T. comes from Chicago to spend the summer in California. He slowly becomes ""California-ized,"" while learning about love and life in the Golden State.","[35, 18, 10749]",10.7828
348,Alien,"During its return to the earth, commercial spaceship Nostromo intercepts a distress signal from a distant planet. When a three-member team of the crew discovers a chamber containing thousands of eggs on the planet, a creature inside one of the eggs attacks an explorer. The entire crew is unaware of the impending nightmare set to descend upon them when the alien parasite planted inside its unfortunate host is birthed.","[27, 878]",27.2062
1096563,End of Loyalty,"When the head of a notorious crime family is murdered, his son Grant is hell bent on payback and the only person that can stop him from tearing the city apart and destroying himself in the process is his best friend and federal agent, Ray Rose.","[80, 28]",13.4628
82702,How to Train Your Dragon 2,"Five years have passed since Hiccup and Toothless united the dragons and Vikings of Berk. Now, they spend their time charting unmapped territories. During one of their adventures, the pair discover a secret cave that houses hundreds of wild dragons -- and a mysterious dragon rider. Now, Hiccup and Toothless find themselves at the center of a battle to protect Berk from a power-hungry warrior.","[14, 28, 12, 16, 35, 10751]",11.5185
1097549,Babygirl,A high-powered CEO puts her career and family on the line when she begins a torrid affair with her much younger intern.,"[18, 10749]",12.4931
1468057,GATAO: Big Brothers,"Michael and his right-hand man Scorpion, who find themselves embroiled in their father Ko's turf war against rival gangs in Taipei, setting off a conflict between old and new generations of gangsters. The film is the latest installment in the Gatao franchise, following the narrative of a young successor trying to expand his power while navigating the volatile underworld.","[80, 28]",17.2633
424,Schindler's List,The true story of how businessman Oskar Schindler saved over a thousand Jewish lives from the Nazis while they worked as slaves in his factory during World War II.,"[18, 36, 10752]",19.4525
1294203,My Fault: London,"18-year-old Noah moves from America to London, with her mother who's recently fallen in love with William, a wealthy British businessman. Noah meets William’s son, bad-boy Nick, and soon discovers there is an attraction between them neither can avoid. As Noah spends the summer adjusting to her new life, her devastating past will catch up with her while falling in love for the first time.","[18, 10749]",13.4722
214756,Ted 2,"Newlywed couple Ted and Tami-Lynn want to have a baby, but in order to qualify to be a parent, Ted will have to prove he's a person in a court of law.","[35, 14]",11.9282
1140535,Presence,"A couple and their children move into a seemingly normal suburban home. When strange events occur, they begin to believe there is something else in the house with them. The presence is about to disrupt their lives in unimaginable ways.","[27, 53, 18]",13.2921
11881,Miracle on 34th Street,"Kris Kringle, seemingly the embodiment of Santa Claus, is asked to portray the jolly old fellow at Macy's following his performance in the Thanksgiving Day parade. His portrayal is so complete that many begin to question if he truly is Santa Claus, while others question his sanity.","[35, 18, 10751]",13.9302
169,Predator 2,A police chief in the war-torn streets of Los Angeles discovers that an extraterrestrial creature is hunting down residents - and that he is the next target.,"[878, 28, 53]",12.6917
112929,School on Fire,"A young schoolgirl, Yuen Fong becomes caught in a tragic stranglehold of triad activity after she testifies in court over a triad beating. When this news reaches the triad leader Brother Smart, Yuen Fong must pay him protection money for what she has done as events begin to escalate.","[18, 80, 53]",7.0237
656908,Ramayana: Part One,First part of the epic Ramayana Duology.,"[28, 18, 14]",13.3233
1252428,Anaconda,"A struggling circus crew gets deceived by its former partner, as it embarks on a tour in Thailand. During the journey through a Southeast Asian rainforest, they encounter attacks by a giant python. They meet a mysterious man named Jeff who offers to help, but they soon realize he's a poacher. As they search for Jeff's boat, they face life-and-death struggles with the python and Jeff himself.","[12, 27, 53]",13.2214
1581,The Holiday,"Two women, one American and one British, swap homes at Christmastime following bad breakups. Each woman finds romance with a local man but realizes that the imminent return home may end the relationship.","[35, 10749]",12.7284
166424,Fantastic Four,"Four young outsiders teleport to a dangerous universe, which alters their physical form in shocking ways. Their lives irrevocably upended, the team must learn to harness their daunting new abilities and work together to save Earth from a former friend turned enemy.","[28, 12, 878]",9.496
1167675,Harry Batt,"DI Harry Batt is called upon to stop a spate of illegal sofa bouncing, and cope with sweeping changes to the police force.","[35, 10751]",10.517
1229910,Kryptic,A woman’s search for a missing cryptzoologist leads to her own riveting cosmic quest for identity.,"[27, 53, 18]",12.6063
396535,Train to Busan,"When a zombie virus pushes Korea into a state of emergency, those trapped on an express train to Busan must fight for their own survival.","[27, 53, 28, 12]",13.6871
4232,Scream,"A year after the murder of her mother, a teenage girl is terrorized by a masked killer who targets her and her friends by using scary movies as part of a deadly game.","[80, 27, 9648]",12.0712
1087891,The Amateur,"After his life is turned upside down when his wife is killed in a London terrorist attack, a brilliant but introverted CIA decoder takes matters into his own hands when his supervisors refuse to take action.","[53, 28]",12.4247
156022,The Equalizer,"McCall believes he has put his mysterious past behind him and dedicated himself to beginning a new, quiet life. But when he meets Teri, a young girl under the control of ultra-violent Russian gangsters, he can’t stand idly by – he has to help her. Armed with hidden skills that allow him to serve vengeance against anyone who would brutalize the helpless, McCall comes out of his self-imposed retirement and finds his desire for justice reawakened. If someone has a problem, if the odds are stacked against them, if they have nowhere else to turn, McCall will help. He is The Equalizer.","[53, 28, 80]",12.3057
214,Saw III,"Jigsaw has disappeared. Along with his new apprentice Amanda, the puppet-master behind the cruel, intricate games that have terrified a community and baffled police has once again eluded capture and vanished. While city detectives scrambles to locate him, Doctor Lynn Denlon and Jeff Reinhart are unaware that they are about to become the latest pawns on his vicious chessboard.","[27, 53, 80]",8.2676
1252428,Anaconda,"A struggling circus crew gets deceived by its former partner, as it embarks on a tour in Thailand. During the journey through a Southeast Asian rainforest, they encounter attacks by a giant python. They meet a mysterious man named Jeff who offers to help, but they soon realize he's a poacher. As they search for Jeff's boat, they face life-and-death struggles with the python and Jeff himself.","[12, 27, 53]",13.2214
13189,A Christmas Carol,"Miser Ebenezer Scrooge is awakened on Christmas Eve by spirits who reveal to him his own miserable existence, what opportunities he wasted in his youth, his current cruelties, and the dire fate that awaits him if he does not change his ways. Scrooge is faced with his own story of growing bitterness and meanness, and must decide what his own future will hold: death or redemption.","[18, 14, 10770, 10751]",13.2165
1519168,The Jester 2,"When teen magician Max crosses paths with the sinister Jester on Halloween night, she must outsmart a supernatural killer whose magic is all too real and whose tricks always end up in blood.","[27, 53, 80]",13.2129
979,Irreversible,A woman’s lover and her ex-boyfriend take justice into their own hands after she becomes the victim of a rapist. Because some acts can’t be undone. Because man is an animal. Because the desire for vengeance is a natural impulse. Because most crimes remain unpunished.,"[18, 53, 80]",13.1661
1865,Pirates of the Caribbean: On Stranger Tides,"Captain Jack Sparrow crosses paths with a woman from his past, and he's not sure if it's love — or if she's a ruthless con artist who's using him to find the fabled Fountain of Youth. When she forces him aboard the Queen Anne's Revenge, the ship of the formidable pirate Blackbeard, Jack finds himself on an unexpected adventure in which he doesn't know who to fear more: Blackbeard or the woman from his past.","[12, 28, 14]",13.1302
271110,Captain America: Civil War,"Following the events of Age of Ultron, the collective governments of the world pass an act designed to regulate all superhuman activity. This polarizes opinion amongst the Avengers, causing two factions to side with Iron Man or Captain America, which causes an epic battle between former allies.","[12, 28, 878]",13.1288
118,Charlie and the Chocolate Factory,"A young boy wins a tour through the most magnificent chocolate factory in the world, led by the world's most unusual candy maker.","[12, 35, 10751, 14]",13.1098
4348,Pride & Prejudice,"A story of love and life among the landed English gentry during the Georgian era. Mr. Bennet is a gentleman living in Hertfordshire with his overbearing wife and five daughters, but if he dies their house will be inherited by a distant cousin whom they have never met, so the family's future happiness and security is dependent on the daughters making good marriages.","[18, 10749]",13.0993
811941,Devara: Part 1,"Devara, a fearless man from a coastal region, embarks on a perilous journey into the treacherous world of the sea to safeguard the lives of his people. Unbeknownst to him, his brother Bhaira is plotting a conspiracy against him. As events unfold, Devara passes on his legacy to his mild-mannered and timid son, Varada.","[28, 18]",11.9071
91314,Transformers: Age of Extinction,"As humanity picks up the pieces after the battle of Chicago, a shadowy group reveals itself in an attempt to control the direction of history…while an ancient, powerful new menace sets Earth in its crosshairs. With help from Cade Yeager, Optimus Prime and the Autobots rise to meet their most fearsome challenge yet.","[878, 28, 12]",13.0733
579974,RRR,A fictional history of two legendary revolutionaries' journey away from home before they began fighting for their country in the 1920s.,"[28, 12, 18]",13.0653
37799,The Social Network,"In 2003, Harvard undergrad and computer programmer Mark Zuckerberg begins work on a new concept that eventually turns into the global social network known as Facebook. Six years later, Mark is one of the youngest billionaires ever, but his unprecedented success leads to both personal and legal complications when he ends up on the receiving end of two lawsuits, one involving his former friend.",[18],13.0466
1151031,Bring Her Back,"Following the death of their father, a brother and sister are sent to live with a foster mother, only to learn that she is hiding a terrifying secret.",[27],13.0396
588228,The Tomorrow War,"The world is stunned when a group of time travelers arrive from the year 2051 to deliver an urgent message: Thirty years in the future, mankind is losing a global war against a deadly alien species. The only hope for survival is for soldiers and civilians from the present to be transported to the future and join the fight. Among those recruited is high school teacher and family man Dan Forester. Determined to save the world for his young daughter, Dan teams up with a brilliant scientist and his estranged father in a desperate quest to rewrite the fate of the planet.","[28, 878, 12]",13.0395
10540,Outland,"On the sunless moon Io, Marshall William T. O’Niel goes toe-to-toe with the corrupt manager of a mining colony and his gang of roughnecks while investigating a rash of worker suicides.","[878, 28, 53, 80]",13.0171
1206008,Ella McCay,"An idealistic young politician juggles familial issues and a challenging work life while preparing to take over the job of her mentor, the state’s longtime incumbent governor.","[35, 18]",13.0159
4935,Howl's Moving Castle,"Sophie, a young milliner, is turned into an elderly woman by a witch who enters her shop and curses her. She encounters a wizard named Howl and gets caught up in his resistance to fighting for the king.","[14, 16, 12]",12.9686
370172,No Time to Die,"Bond has left active service and is enjoying a tranquil life in Jamaica. His peace is short-lived when his old friend Felix Leiter from the CIA turns up asking for help. The mission to rescue a kidnapped scientist turns out to be far more treacherous than expected, leading Bond onto the trail of a mysterious villain armed with dangerous new technology.","[28, 53, 12]",12.95
1043197,Dust Bunny,"Ten-year-old Aurora asks her hitman neighbor to kill the monster she believes ate her entire family. To protect her, he'll need to battle an onslaught of assassins while accepting the fact that some monsters are real.","[28, 14, 27, 53]",12.944
6977,No Country for Old Men,"Llewelyn Moss stumbles upon dead bodies, $2 million and a hoard of heroin in a Texas desert, but methodical killer Anton Chigurh comes looking for it, with local sheriff Ed Tom Bell hot on his trail. The roles of prey and predator blur as the violent pursuit of money and justice collide.","[80, 53, 37]",12.9197
637649,Wrath of Man,"A cold and mysterious new security guard for a Los Angeles cash truck company surprises his co-workers when he unleashes precision skills during a heist. The crew is left wondering who he is and where he came from. Soon, the marksman's ultimate motive becomes clear as he takes dramatic and irrevocable steps to settle a score.","[53, 80, 18]",12.7742
49040,The Bourne Legacy,New CIA operative Aaron Cross experiences life-or-death stakes that have been triggered by the previous actions of Jason Bourne.,"[28, 53]",11.4508
10195,Thor,"Against his father Odin's will, The Mighty Thor - a powerful but arrogant warrior god - recklessly reignites an ancient war. Thor is cast down to Earth and forced to live among humans as punishment. Once here, Thor learns what it takes to be a true hero when the most dangerous villain of his world sends the darkest forces of Asgard to invade Earth.","[12, 14, 28]",12.5537
1151272,Sirāt,"A man and his son arrive at a rave lost in the mountains of Morocco. They are looking for Marina, their daughter and sister, who disappeared months ago at another rave. Driven by fate, they decide to follow a group of ravers in search of one last party, in hopes Marina will be there.","[18, 53]",12.4973
