movie_id,title,overview,genre_ids,popularity
679,Aliens,"Ripley, the sole survivor of the Nostromo's deadly encounter with the monstrous Alien, returns to Earth after drifting through space in hypersleep for 57 years. Although her story is initially met with skepticism, she agrees to accompany a team of Colonial Marines back to LV-426.","[28, 53, 878]",16.4899
80321,Madagascar 3: Europe's Most Wanted,"Animal pals Alex, Marty, Melman, and Gloria are still trying to make it back to New York's Central Park Zoo. They are forced to take a detour to Europe to find the penguins and chimps who broke the bank at a Monte Carlo casino. When French animal-control officer Capitaine Chantel DuBois picks up their scent, Alex and company are forced to hide out in a traveling circus.","[16, 10751, 35, 12]",15.3397
361743,Top Gun: Maverick,"After more than thirty years of service as one of the Navy’s top aviators, and dodging the advancement in rank that would ground him, Pete “Maverick” Mitchell finds himself training a detachment of TOP GUN graduates for a specialized mission the likes of which no living pilot has ever seen.","[28, 18]",18.9761
414906,The Batman,"In his second year of fighting crime, Batman uncovers corruption in Gotham City that connects to his own family while facing a serial killer known as the Riddler.","[80, 9648, 53]",23.9863
1161617,Code 3,A burned-out paramedic tries to survive his last 24 hours on the job while training a new recruit.,"[28, 35]",19.284
1261825,Oh. What. Fun.,"Claire Clauster is the glue that holds her chaotic, lovable family together at the holidays. But this year, after planning a special outing for them, they make a crucial mistake and leave her home alone. Fed up and feeling under appreciated, she sets off on an impromptu adventure of her own. As her family scrambles to find her, Claire discovers the unexpected magic of a Christmas gone off-script.",[35],18.4482
272,Batman Begins,"Driven by tragedy, billionaire Bruce Wayne dedicates his life to uncovering and defeating the corruption that plagues his home, Gotham City.  Unable to work within the system, he instead creates a new identity, a symbol of fear for the criminal underworld - The Batman.","[18, 80, 28]",19.2791
49026,The Dark Knight Rises,"Following the death of District Attorney Harvey Dent, Batman assumes responsibility for Dent's crimes to protect the late attorney's reputation and is subsequently hunted by the Gotham City Police Department. Eight years later, Batman encounters the mysterious Selina Kyle and the villainous Bane, a new terrorist leader who overwhelms Gotham's finest. The Dark Knight resurfaces to protect a city that has branded him an enemy.","[28, 80, 18, 53]",20.2858
639988,No Other Choice,"After being laid off and humiliated by a ruthless job market, a veteran paper mill manager descends into violence in a desperate bid to reclaim his dignity.","[80, 53, 18]",21.7676
508,Love Actually,Eight very different couples deal with their love lives in various loosely interrelated tales all set during a frantic month before Christmas in London.,"[35, 10749, 18]",19.3708
1025527,Abyss,"11 years ago, inspector Malik couldn’t solve a kidnapping case and a little girl died. Now with only a few days before the crime gets classified, he decides to reopen the case. Malik owes it to the mother and to himself. As he digs into the past, a child is kidnapped again. The pattern is the same one as a decade ago, it’s no coincidence. Malik knows he has a few days to make things right and to bring justice.","[53, 28]",19.8873
1100988,28 Years Later,"Twenty-eight years since the rage virus escaped a biological weapons laboratory, now, still in a ruthlessly enforced quarantine, some have found ways to exist amidst the infected. One such group lives on a small island connected to the mainland by a single, heavily-defended causeway. When one member departs on a mission into the dark heart of the mainland, he discovers secrets, wonders, and horrors that have mutated not only the infected but other survivors as well.","[27, 53, 878]",19.2069
557,Spider-Man,"After being bitten by a genetically altered spider at Oscorp, nerdy but endearing high school student Peter Parker is endowed with amazing powers to become the superhero known as Spider-Man.","[28, 878]",29.0601
1325678,Sarah's Oil,"Sarah Rector, an African-American girl born in Oklahoma Indian Territory in the early 1900s, believes there is oil beneath the barren land she’s allotted, and her faith is proven right. As greedy oil sharks close in, Sarah turns to her family, friends, and some Texas wildcatters to maintain control of her oil-rich land, eventually becoming among the nation's first female African-American millionaires—at eleven years old.",[18],17.4036
1064213,Anora,"A young sex worker from Brooklyn gets her chance at a Cinderella story when she meets and impulsively marries the son of an oligarch. Once the news reaches Russia, her fairytale is threatened as his parents set out to get the marriage annulled.","[18, 35, 10749]",19.2693
624860,The Matrix Resurrections,"Plagued by strange memories, Neo's life takes an unexpected turn when he finds himself back inside the Matrix.","[878, 28, 12]",25.5785
511082,Black Butler: Book of Murder,"At the Queen’s request, Ciel and the demon butler Sebastian host an extravagant dinner party for the who’s who of the London underground. But an evening that begins with the promise of unmatched elegance quickly spirals into mayhem when their most distinguished guest is found murdered in his room. Now, trapped in the Phantomhive Manor by a dark and stormy night, Ciel and Sebastian must work together with their high-class guests, including the legendary author Sir Arthur Conan Doyle, to find the murderer in their midst before the blame falls on the host and his somewhat suspicious staff.","[9648, 16, 12, 28]",18.894
1292681,I'm Gonna Disappear,"Rocío and David are two siblings who meet again after ten years without seeing each other. David has been incarcerated all this time. When he takes advantage of a prison furlough to escape with his sister to Puerto Plata, the tourist town where they used to spend the summer as a family, they reconnect, recovering memories and making up for lost time.","[35, 18]",20.1954
1186350,Marco,"The adoptive son of the Adattu family, Marco, sets off on a ruthless quest for vengeance after his brother is brutally murdered, finding only betrayal, loss and unimaginable brutality at every step.","[28, 80, 53]",19.6594
5825,National Lampoon's Christmas Vacation,"It's Christmastime, and the Griswolds are preparing for a family seasonal celebration. But things never run smoothly for Clark, his wife Ellen, and their two kids. Clark's continual bad luck is worsened by his obnoxious family guests, but he manages to keep going, knowing that his Christmas bonus is due soon.",[35],20.0032
333339,Ready Player One,"When the creator of a popular video game system dies, a virtual contest is created to compete for his fortune.","[12, 28, 878]",27.4099
1071585,M3GAN 2.0,"After the underlying tech for M3GAN is stolen and misused by a powerful defense contractor to create a military-grade weapon known as Amelia, M3GAN's creator Gemma realizes that the only option is to resurrect M3GAN and give her a few upgrades, making her faster, stronger, and more lethal.","[28, 878, 53]",19.1906
1280518,Laberinto de sombras,,[27],17.142
912649,Venom: The Last Dance,"Eddie and Venom are on the run. Hunted by both of their worlds and with the net closing in, the duo are forced into a devastating decision that will bring the curtains down on Venom and Eddie's last dance.","[28, 878, 12]",18.3194
12,Finding Nemo,"Nemo, an adventurous young clownfish, is unexpectedly taken from his Great Barrier Reef home to a dentist's office aquarium. It's up to his worrisome father Marlin and a friendly but forgetful fish Dory to bring Nemo home -- meeting vegetarian sharks, surfer dude turtles, hypnotic jellyfish, hungry seagulls, and more along the way.","[16, 10751]",20.289
9502,Kung Fu Panda,"When the Valley of Peace is threatened, lazy Po the panda discovers his destiny as the ""chosen one"" and trains to become a kung fu hero, but transforming the unsleek slacker into a brave warrior won't be easy. It's up to Master Shifu and the Furious Five -- Tigress, Crane, Mantis, Viper and Monkey -- to give it a try.","[16, 10751, 35, 28, 12]",17.6483
917496,Beetlejuice Beetlejuice,"After a family tragedy, three generations of the Deetz family return home to Winter River. Still haunted by Betelgeuse, Lydia's life is turned upside down when her teenage daughter, Astrid, accidentally opens the portal to the Afterlife.","[35, 14, 27]",25.2229
1064307,Spermageddon,"Two narrative threads: one is an emerging love story between awkward teens Jens and Lisa, who are having sex for the first time; the other, an eventful quest of Simon the Semen and his friends to reach the golden goal, the Egg.","[16, 12, 14, 35]",22.5203
1219158,Lover,"An alcoholic designer struggles to save his six-year relationship while facing personal challenges and misunderstandings. As their bond is tested, he begins to confront his past and question whether love alone is enough to hold them together.","[10749, 18]",19.1584
1470086,Ligaw,"A sultry woman who charms the hearts of men in a remote province. Dolores, a devoted wife to her paraplegic husband, falls for a young mountaineer. What begins as a reckless escape turns into an affair drenched in passion and secrecy.","[18, 10749]",18.1322
1119090,I Am Frankelda,"Frankelda, a frustrated young Mexican writer from the 19th Century, travels in the form of a ghost to a kingdom of her own invention inhabited by Spooks, which are all the monstrous characters she created in her horror tales. Her guide is Herneval, the Prince of Spooks, who takes her to help him save the balance between the Realm of Fiction and the Realm of Existence by using her talent as a writer.","[16, 10751, 14, 27]",57.835
22,Pirates of the Caribbean: The Curse of the Black Pearl,"After Port Royal is attacked and pillaged by a mysterious pirate crew, capturing the governor's daughter Elizabeth Swann in the process, William Turner asks free-willing pirate Jack Sparrow to help him locate the crew's ship—The Black Pearl—so that he can rescue the woman he loves.","[12, 14, 28]",28.1339
1196207,The Night My Dad Saved Christmas 2,"When Santa vanishes during a chaotic Christmas, a quirky actor tries to replace him. A father, his teen son and special friends must rescue Santa to save Christmas.","[35, 10751]",17.1278
295206,Separation Anxiety,"Separation Anxiety traces the friendship of three twenty-something childhood pals, Quinn, Jess, and Bailey on the morning of Bailey's funeral. As the people who loved Bailey the most grapple with the possibility that his fatal accident might have been something more purposeful, flashbacks from the last days of Bailey Palmer begin to unravel what was really going on. Quinn and Jess find themselves forced to deal with truths they aren't ready to face, about Bailey and each other.",[18],12.677
746036,The Fall Guy,"Fresh off an almost career-ending accident, stuntman Colt Seavers has to track down a missing movie star, solve a conspiracy and try to win back the love of his life while still doing his day job.","[28, 35, 10749]",14.8548
126661,Gramps Is a Great Guy!,"Nightclub musician Sebastian, discovers one evening with surprise that he is supposedly the grandfather of a boy with the same name as him.",[35],17.8853
929590,Civil War,"In the near future, a group of war journalists attempt to survive while reporting the truth as the United States stands on the brink of civil war.","[10752, 28, 18]",23.7036
475557,Joker,"During the 1980s, a failed stand-up comedian is driven insane and turns to a life of crime and chaos in Gotham City while becoming an infamous psychopathic crime figure.","[80, 53, 18]",21.4947
1400382,Predators,"In the mid-aughts, Dateline NBC’s To Catch a Predator drew millions of weekly viewers to watch sting operations: men planning to meet minors for sex would instead be confronted by polished host Chris Hansen, then by the police — all on hidden camera.",[99],15.5311
299534,Avengers: Endgame,"After the devastating events of Avengers: Infinity War, the universe is in ruins due to the efforts of the Mad Titan, Thanos. With the help of remaining allies, the Avengers must assemble once more in order to undo Thanos' actions and restore order to the universe once and for all, no matter what consequences may be in store.","[12, 878, 28]",22.6383
1195631,William Tell,"The narrative unfolds in the 14th Century, when the European nations vie for supremacy within the Holy Roman Empire. The ambitious Austrian Empire, desiring more land, invades neighbouring Switzerland, a serene and pastoral nation. Protagonist William Tell, a formerly peaceful hunter, finds himself forced to take action as his family and homeland come under threat from the oppressive Austrian King and his ruthless warlords.","[28, 12, 18, 36]",16.0331
203151,The Sanatorium,"A group of friends decide to make a documentary about the ghosts that are supposed to be haunting The Sanatorium in Costa Rica, things get creepy when the arrive to the place.","[27, 35]",14.0351
866398,The Beekeeper,One man's campaign for vengeance takes on national stakes after he is revealed to be a former operative of a powerful and clandestine organization known as Beekeepers.,"[28, 80, 53]",18.8932
1241983,Train Dreams,A logger leads a life of quiet grace as he experiences love and loss during an era of monumental change in early 20th-century America.,[18],18.2595
36225,Oxen Split Torturing,"Two short stories set in Edo during the Shogun era. The first, during a time when Christians are persecuted vehemently, Iori falls in love with a young Christian girl. When she and her family are captured during a raid, his sadistic master takes her as his personal slave to torment Iori. The second follows Sutezo who, forced to serve the barbarous master of a brothel in order to repay his debts, befriends a young girl. Together, they both escape and struggle to get by on scams and petty theft.","[27, 18]",19.8605
1280450,Stolen Girl,"In 1993, Maureen’s six-year-old daughter Amina is snuck out of the country by her ex-husband, Karim. After years of unsuccessful attempts to find her, Maureen intersects with a professional retriever of internationally abducted children who promises to help her find Amina in exchange for her collaboration.","[53, 28, 12]",19.1131
466,Klute,A high-priced call girl is forced to depend on a reluctant private eye when she is stalked by a psychopath.,"[53, 9648, 80]",10.0614
1316147,Grand Prix of Europe,"Edda, a young mouse and the daughter of fairground operator Erwin, dreams of becoming a race car driver. Ahead of the 50th anniversary of the European Grand Prix, Edda gets the opportunity to meet her idol, racing star Ed, and to help her father save his failing business. But to do so, she'll have to get behind the wheel herself.","[16, 12, 35]",15.8791
1550797,Prep & Landing: The Snowball Protocol,"Christmas elves Lanny and Wayne panic when their holiday missions go awry, leaving Wayne thinking he's in BIG trouble with Santa and accidentally revealing other merry mishaps.",[16],17.3939
216015,Fifty Shades of Grey,"When college senior Anastasia Steele steps in for her sick roommate to interview prominent businessman Christian Grey for their campus paper, little does she realize the path her life will take. Christian, as enigmatic as he is rich and powerful, finds himself strangely drawn to Ana, and she to him. Though sexually inexperienced, Ana plunges headlong into an affair -- and learns that Christian's true sexual proclivities push the boundaries of pain and pleasure.","[18, 10749, 53]",18.0518
1522377,Two Worlds One Wish,"Twenty-one years after a magical meeting at a children's hospital, Bilge and Can suddenly begin hearing each other's voices telepathically. What seems like a miracle soon reveals a hidden secret, as fate-reuniting them after decades-has much more in store.","[10749, 18]",18.022
464052,Wonder Woman 1984,A botched store robbery places Wonder Woman in a global battle against a powerful and mysterious ancient force that puts her powers in jeopardy.,"[28, 12, 14]",17.353
259316,Fantastic Beasts and Where to Find Them,"In 1926, Newt Scamander arrives at the Magical Congress of the United States of America with a magically expanded briefcase, which houses a number of dangerous creatures and their habitats. When the creatures escape from the briefcase, it sends the American wizarding authorities after Newt, and threatens to strain even further the state of magical and non-magical relations.","[14, 12]",17.4969
57158,The Hobbit: The Desolation of Smaug,"The Dwarves, Bilbo and Gandalf have successfully escaped the Misty Mountains, and Bilbo has gained the One Ring. They all continue their journey to get their gold back from the Dragon, Smaug.","[14, 12, 28]",20.8459
1325958,The Travellers,"Stephen Seary, a stage designer, returns to Australia to visit his dying mother, but a quick trip descends into family tensions, past conflicts, and romantic complications, jeopardizing his return to Europe and the opera that awaits.",[18],16.0013
1339206,The Surrender,"A fraught mother-daughter relationship is put to a terrifying test when the family patriarch dies, and the grieving mother hires a mysterious stranger to bring her husband back from the dead.","[18, 27]",15.9282
68718,Django Unchained,"With the help of a German bounty hunter, a freed slave sets out to rescue his wife from a brutal Mississippi plantation owner.","[18, 37]",16.4964
769,GoodFellas,"The true story of Henry Hill, a half-Irish, half-Sicilian Brooklyn kid who is adopted by neighbourhood gangsters at an early age and climbs the ranks of a Mafia family under the guidance of Jimmy Conway.","[18, 80]",17.7786
1404791,Dollhouse,"After losing their child, a mother finds solace in a life-sized ancient doll she finds on the market.  When a new daughter enters the family's life, strange things begin to happen and no matter how hard the family tries to get rid of it, the doll always finds its way back.","[27, 9648]",16.903
424270,Black Something,"In late 2015, ""Bright Ideas"" magazine and its publisher, the innovative crowdfunding and distribution platform Seed &amp; Spark, commissioned directing duo the Zellner Bros. (KUMIKO, THE TREASURE HUNTER) to make a short piece in response to a Criterion Collection release that they considered inspiring. The brothers chose Louis Malle's wild, hallucinogenic BLACK MOON (1975), itself a tripped-out reimagining of ""Alice in Wonderland."" Shot in the woods near their Austin homes, BLACK SOMETHING captures Malle's blending of idyllic pastoral imagery with nightmarish fantasy, distilling it into a skin-crawlingly unsettling three-minute short.",[],9.1778
1456349,It Was Just an Accident,"Vahid, an Azerbaijani auto mechanic, was once imprisoned by Iranian authorities. During his sentence, he was interrogated blindfolded. One day, a man named Eqbal enters his workshop. His prosthetic leg creaks, and Vahid thinks he recognizes one of his former torturers.","[18, 53, 80]",28.9937
161,Ocean's Eleven,"Less than 24 hours into his parole, charismatic thief Danny Ocean is already rolling out his next plan: In one night, Danny's hand-picked crew of specialists will attempt to steal more than $150 million from three Las Vegas casinos. But to score the cash, Danny risks his chances of reconciling with ex-wife, Tess.","[53, 80]",15.4311
313369,La La Land,"Mia, an aspiring actress, serves lattes to movie stars in between auditions and Sebastian, a jazz musician, scrapes by playing cocktail party gigs in dingy bars, but as success mounts they are faced with decisions that begin to fray the fragile fabric of their love affair, and the dreams they worked so hard to maintain in each other threaten to rip them apart.","[35, 18, 10749]",22.204
749170,Heads of State,"The UK Prime Minister and US President have a public rivalry that risks their countries' alliance. But when they become targets of a powerful enemy, they're forced to rely on each other as they go on a wild, multinational run. Allied with Noel, a brilliant MI6 agent, they must find a way to thwart a conspiracy that threatens the free world.","[28, 53, 35]",31.64
760329,The Smashing Machine,"In the late 1990s, up-and-coming mixed martial artist Mark Kerr aspires to become the greatest fighter in the world. However, he must also battle his opioid dependence and a volatile relationship with his girlfriend Dawn.","[36, 18]",19.0997
105,Back to the Future,"Eighties teenager Marty McFly is accidentally sent back in time to 1955, inadvertently disrupting his parents' first meeting and attracting his mother's romantic interest. Marty must repair the damage to history by rekindling his parents' romance and - with the help of his eccentric inventor friend Doc Brown - return to 1985.","[12, 35, 878]",17.1768
205596,The Imitation Game,"Based on the real life story of legendary cryptanalyst Alan Turing, the film portrays the nail-biting race against time by Turing and his brilliant team of code-breakers at Britain's top-secret Government Code and Cypher School at Bletchley Park, during the darkest days of World War II.","[36, 18, 53, 10752]",19.1751
348893,Boyka: Undisputed IV,"In the fourth installment of the fighting franchise, Boyka is shooting for the big leagues when an accidental death in the ring makes him question everything he stands for. When he finds out the wife of the man he accidentally killed is in trouble, Boyka offers to fight in a series of impossible battles to free her from a life of servitude.","[28, 18, 53]",15.1342
505642,Black Panther: Wakanda Forever,"Queen Ramonda, Shuri, M’Baku, Okoye and the Dora Milaje fight to protect their nation from intervening world powers in the wake of King T’Challa’s death.  As the Wakandans strive to embrace their next chapter, the heroes must band together with the help of War Dog Nakia and Everett Ross and forge a new path for the kingdom of Wakanda.","[28, 12, 878]",15.5218
1290159,A House of Dynamite,"When a single, unattributed missile is launched at the United States, a race begins to determine who is responsible and how to respond.",[53],17.1596
13570,Tourist Trap,"After their car breaks down, a group of young travelers find themselves stranded at a roadside museum run by the enigmatic Mr. Slausen and populated by his collection of life-like wax mannequins.","[27, 14]",9.6586
11,Star Wars,Princess Leia is captured and held hostage by the evil Imperial forces in their effort to take over the galactic Empire. Venturesome Luke Skywalker and dashing captain Han Solo team together with the loveable robot duo R2-D2 and C-3PO to rescue the beautiful princess and restore peace and justice in the Empire.,"[12, 28, 878]",25.7163
427641,Rampage,"Primatologist Davis Okoye shares an unshakable bond with George, the extraordinarily intelligent, silverback gorilla who has been in his care since birth.  But a rogue genetic experiment gone awry mutates this gentle ape into a raging creature of enormous size.  To make matters worse, it’s soon discovered there are other similarly altered animals.  As these newly created alpha predators tear across North America, destroying everything in their path, Okoye teams with a discredited genetic engineer to secure an antidote, fighting his way through an ever-changing battlefield, not only to halt a global catastrophe but to save the fearsome creature that was once his friend.","[28, 12, 878]",14.2029
1328803,Prisoner of War,British RAF Wing Commander James Wright is captured by the Japanese during WWII and forced to fight in brutal hand-to-hand combat. The Japanese soldiers get more than they bargained for when Wright’s years of martial arts training in Hong Kong prove him to be a formidable opponent.,"[28, 10752, 53, 36]",16.6722
425909,Ghostbusters: Afterlife,"When single mom Callie and her two kids Trevor and Phoebe arrive in a small Oklahoma town, they begin to discover their connection to the original Ghostbusters and the secret legacy their grandfather left behind.","[14, 35, 12, 878]",19.7219
634492,Madame Web,"Forced to confront revelations about her past, paramedic Cassandra Webb forges a relationship with three young women destined for powerful futures...if they can all survive a deadly present.","[28, 14]",17.7356
565723,The Secret to My Silky Skin,"A boy who lives with his parents in Kyoto comes to Tokyo for a business trip and stays with his fuck buddy. They have no special plans for the five days together. They will go to work in the morning, come home, spend the evening together, and sleep. The first night when he arrives, the fuck buddy starts to have sex with him just as usual, but he is somehow unable to respond. In fact, he has been concerned about a certain thing since before he visits Tokyo.",[18],13.2828
35712,Secret Things,"Two young women find themselves struggling to survive in Paris, street-wise Nathalie, a stripper, and naïve Sandrine, a barmaid. Together, they discover that sex can be used to their advantage, and pleasure.",[18],16.9749
11324,Shutter Island,"World War II soldier-turned-U.S. Marshal Teddy Daniels investigates the disappearance of a patient from a hospital for the criminally insane, but his efforts are compromised by troubling visions and a mysterious doctor.","[18, 53, 9648]",25.1718
670,Oldboy,"With no clue how he came to be imprisoned, drugged and tortured for 15 years, a desperate man seeks revenge on his captors.","[18, 53, 9648, 28]",16.3772
